tema,pavadinimas,tekstas,url
veidai,Nesantaika tarp Lilo ir Innomine bei OG Version: kas nutiko?,"Savaitgalį Lilas ir Innomine savo gerbėjams pristatė kūrinį, kuriame apdainavo OG Version per M.A.M.A. apdovanojimus grupės nariams mestas replikas dėl kuriamos neva serialams skirtos muzikos. Į tai akimirksniu sureagavo ir pats OG Version. Sekmadienį Lilas ir Innomine pristatė kūrinį Labubu, kuriame apdainuotas OG Version. Jeigu be skandalų? Jei be fonogramos? Jei bent sakinuką vieną rišlų ar įmanoma? Kas nutiko, Labubu, ko tau neramu taip? Kas nutiko, Labubu, negi tai iš kvailumo tik? Nežinai kas per hiphopas, tu nesupranti tipo? Mes dėdės iš kurių nuomojies mašinas klipam, mes priežastis pirma ir paskutinė, balvone, dėl ko vardas tavo skambės stadione, - skamba žodžiai Lilo ir Innomine dainoje. Į tokį grupės narių pareiškimą netrukus sureagavo ir OG Version, pristatęs savo kūrinį Lilas ir be nuomonės. Tiesa, panašu, kad kūrinys, kuriame skamba kur kas aštesnės replikos Lilo ir Innomine aplinkai, sulaukė daug kritikos iš OG Version gerbėjų. Tau gi sakė nesivelt, atrodo, kad tu debilas . Būsiu aš didesnis, o ne Lilas, ne kaip Innomine, girdėjau domina tave ten mergos kominės. Tada su***o patį tave iki būsenos ten kominės. Tipo veidai visuomenės, už Ukrainą ar už ką tu niūchas , p*****s , g******s . Gal dar paliečiam ir žmonas? - repavo OG Version. Akimirksniu po juo pasipylė ir kritikos negailintys komentarai: Gal ir gerai kad tą studiją atėmė iš tavęs; Nežinau kaip veikia šitie dalykai jūsų pasaulyje, bet paklausius abu gabalus labai jaučiasi, kuris yra kūrėjas, o kuris niuchas iš Šilainių; Pas Lilą nei vieno rusiško keiksmažodžio nebuvo, o čia kas penktas žodis. Daug ką parodo...; Pavydžiu žmonėm kurie neklausė šito gabalo. Sekmadienį į Lilo ir Innomine instagrame paviešintas žinutes apie naują kūrinį, kurį įkvėpė OG Version keiksmai per M.A.M.A. apdovanojimus, sureagavo ir pats reperis. Jis teigė, kad grupė tokiu savo pareiškimu tik nori sulaukti dėmesio. Prieš kelis mėnesius nugriaudėję M.A.M.A. apdovanojimai neapsiėjo be skandalų. Hiphopo muzikos grupės apdovanojimą atsiėmę Lilas ir Innomine sulaukė OG Version replikų, į kurias galiausiai sureagavo šį sekmadienį. Delfi jau anksčiau rašė, kad šiais metais per M.A.M.A. apdovanojimus reperis OG Version svaidėsi užgauliomis replikomis ne tik priešais filmavimo kameras, bet ir socialiniuose tinkluose. Pretendavęs į Metų hip-hop muzikos grupės ar atlikėjo apdovanojimą, Dominykas Ježerys-OG Version greičiausiai tikėjosi ir atsiimti šį trofėjų. Vis dėlto jį pelnė Lilas ir Innomine. Šia proga OG Version savo instagramo istorijoje išreiškė asmeninę nuomonę. B***s čia, ne hip-hopas, - rėžė Dominykas. Paskui pasidalijo dar platesne nuomone: Serialų muzika k***a . O kur hip-hopas? Ir nors vasario mėnesį į tokias OG Version replikas Lilas ir Innomine nusprendė nereaguoti, šį sekmadienį grupė instagrame ir vėl priminė šiuos OG Version įrašus. Vėliau Lilas ir Innomine pasidalijo publikacijų antraštėmis, kurios buvo paviešintos po OG Version mestų replikų. Galiausiai grupės nariai kvietė savo gerbėjus pasiruošti popkornų ir laukti naujos dainos, kuri Youtube kanale buvo paviešinta sekmadienį, 19 val., kaip atsakas į OG Version žodžius. Į tokį netikėtą Lilo ir Innomine pareiškimą akimirksniu sureagavo ir OG Version. Instagrame jis pasidalijo keliais įrašais, kuriame išreiškė nuomonę, kad grupė tik nori sulaukti daugiau dėmesio. Ooo, cloutchaseriai . 19.02 pasiruoškit Estrella mėlynus, bus popkornų. Seni , jūs kol įkelsit, aš jum 3 dissus spėsiu parašyt, - rašė OG Version ir pasidalino šią situaciją aptariančiomis žinutėmis su atlikėju Proflame. M.A.M.A. apdovanojimų akimirkos - galerijose:",https://www.delfi.lt/veidai/muzika/nesantaika-tarp-lilo-ir-innomine-bei-og-version-kas-nutiko-120242553
veidai,"Viktorija Siegel – apie jai klijuojamą klaidingą etiketę: esu tokia, kokia esu","Garsi šalies verslininkė, nuomonės formuotoja Viktorija Siegel ryžosi itin atviram pokalbiui Viktorijos Macijauskienės Inner Minds tinklalaidėje. Ten moterys šnekučiavosi pačiomis įvairiausiomis, daugeliui moterų aktualiomis temomis, kartu atsigręždamos ir į klaidingas nuomones, kurios apie V. Siegel esą pasigirsta viešumoje. Instagrame pasirodžiusioje laidos iškarpoje V. Siegel apie klaidingus įsivaizdavimus ir tai, kaip jaučiasi pati, kalbėjo: Aš iš šono kai kam atrodau arogantiška. Bet aš manau, kad aš nesu arogantiška. Aš tiesiog esu tokia, kokia esu. Kartais aš tiesiog labai tiesmukiškai bendrauju, dėl to gali atrodyti, kad kažką per daug pasakai. Tokios vidinės stiprybės, pasitikėjimo savimi ir netgi savotiško atsparumo V. Siegel esą išmokė pats gyvenimas ir jame pasitaikiusios ne visada lengvos patirtys. Prieš metus aš jaučiausi gerai, tvirtai, bet toli gražu ne taip, kaip dabar. Dabar pas mane visiška vidinė harmonija, ramybė. Aš visą savo praeitį traktuoju kaip labai geras pamokas ir savęs auginimą. Tie, kas yra šalia manęs, man tikrai ne kartą yra pasakę: Viktorija, tu labai paaugai per pastaruosius metus - tu užaugai kaip asmenybė, - laidoje taip pat kalbėjo garsi verslininkė. Primename, kad pastaruoju metu V. Siegel pamatyti įvairiose TV laidose ar išgirsti dalijant interviu galima tikrai retai. Tiesa, praėjusiais metais garsi moteris svečiavosi ir Delfi TV laidoje Nuogas pokalbis su Danieliumi Bunkumi - šį pokalbį žiūrėti galite čia:",https://www.delfi.lt/veidai/zmones/viktorija-siegel-apie-jai-klijuojama-klaidinga-etikete-esu-tokia-kokia-esu-120239837
veidai,Žiauriai nužudyto Manto Sadausko kolegos atvėrė širdis: skaudūs įtarimai kilo nuo pirmų akimirkų,"Praėjusią savaitę Lietuvą sukrėtė kraupi istorija - Panevėžio rajone nužudytas 31 metų paramedikas Mantas Sadauskas . Žiauriu nusikaltimu įtariama vyro buvusi sutuoktinė, tituluota kultūristė Justina Gaigalaitė ir jos naujasis draugas. Savaitgalį, atsisveikindami su velioniu, M. Sadausko artimieji, draugai ir kolegos dalijosi jautriais prisiminimais, o kai kurie neslėpė - neva nuo pat pradžių turėjo įtarimų, kad šioje istorijoje neišvengiamai figūruos buvusios žmonos vardas. Pirmadienio vakarą laidoje KK2 parodytas reportažas iš atsisveikinimo su M. Sadausku, kuriame artimieji ir kolegos dalijosi skaudžiais prisiminimais. Velionio kolegės, sunkiai tvardydamos emocijas, atviravo apie pirmąsias mintis, sužinojus apie tragediją. Asmeniškai mano pirma mintis tokia ir buvo, kad Justina prikišusi nagus. Jis buvo užsiminęs, kad ten - konfliktai, viskas, - kalbėjo M. Sadausko kolegė Gitana. Jai antrino ir greitosios medicinos pagalbos darbuotoja Neringa. Pagalvojau tą patį - blogiausią, ką ir visi. Kodėl? Todėl, kad aplinkybės tokios jo asmeninio gyvenimo, - neslėpė ji. Dar viena kolegė, sunkiai tvardydama emocijas, žurnalistams kalbėjo apie negrįžtamą netektį ir prisipažino - jei galėtų, įtariamajai užduotų tik vieną klausimą. Manto jau nebėra ir nebebus. Visi tą supranta. Gerai yra bent tiek, kad už tai atsakingi asmenys yra sulaikyti. Aš užduočiau tai moteriai tik vieną klausimą - ar tu supranti, ką tu padarei savo vaikams, Justina? Ar supranti? - su ašaromis kalbėjo ji. Primename, kad sekmadienio popietę šios savaitės pradžioje žiauriai nužudytas M. Sadauskas atgulė amžinojo poilsio Raguvėlės kapinėse. Jo kapas liko nuklotas baltais gėlių žiedais, šalia kurių buvo matyti ir jautrūs šeimos žodžiai. Atsisveikinti su M. Sadausku susirinko būrys jo artimųjų, kolegų ir bičiulių. Vyro kapą nuklojus baltiems gėlių žiedams, šalia jų buvo galima matyti ir užrašus Ilsėkis ramybėje, Mantukui nuo GMP kolektyvo.",https://www.delfi.lt/veidai/ivairenybes/ziauriai-nuzudyto-manto-sadausko-kolegos-atvere-sirdis-skaudus-itarimai-kilo-nuo-pirmu-akimirku-120242691
veidai,Valujavičiui vėjas nebaisus: pats vienas nuo kelio patraukė medį,"Lietuvoje šiuo metu orai tikrai nelepina - pučia labai stiprus vėjas, o temperatūra išlieka gana žema. Dėl tokių sąlygų kai kuriose vietovėse neatlaikė ir medžiai. Vis dėlto panašu, kad keliautojui Aurimui Valujavičiui gamtos išdaigos nebaisios. Savo ryžtą jis pademonstravo keliaudamas po Lietuvą, kai visiškai netikėtai jo kelią užtvėrė nuvirtęs medis. Užuot skambinęs pagalbai ar laukęs, kol situacija bus išspręsta, vyras nusprendė imtis veiksmų pats. Instagram paskyroje paskelbtame vaizdo įraše matyti, kaip A. Valujavičius be didesnių sunkumų patraukia ant kelio nuvirtusį medį, taip atlaisvindamas pravažiavimą. Situaciją jis pakomentavo trumpai ir su šypsena: Sekmadienio vėjas niekadėjas. Primename, kad savaitgalį Lietuvoje vyravo itin permainingi orai - dangų dažnai dengė nepastovus debesuotumas, o daugelyje šalies vietovių gyventojai sulaukė ne tik trumpalaikio sniego, bet ir pavasariui nebūdingų reiškinių. Remiantis meteo.lt duomenimis, daug kur kelis kartus trumpai pasnigo - krito šlapios snaigės ir sniego kruopos. Kai kur netgi nugriaudėjo perkūnija, kas šiuo metų laiku yra gana retas reiškinys. Be to, pūtė itin stiprus vėjas: daugelyje rajonų jo gūsiai siekė 15-20 m/s, o kai kur sustiprėjo net iki 23 m/s. Tokios oro sąlygos ne tik trikdė eismą, bet ir kėlė pavojų gyventojų saugumui, todėl specialistai ragina išlikti budriems.",https://www.delfi.lt/veidai/zmones/valujaviciui-vejas-nebaisus-pats-vienas-nuo-kelio-patrauke-medi-120242514
veidai,Modesta Vžesniauskaitė pademonstravo tikrą eleganciją: sunku atitraukti akis,"Išskirtiniais įvaizdžiais garsėjanti Modesta Vžesniauskaitė šį savaitgalį dar kartą įrodė savo nepriekaištingą stiliaus pojūtį. Nors šįkart jos pasirinktas derinys buvo kiek subtilesnis nei įprastai, jis vis tiek neliko nepastebėtas ir traukė aplinkinių žvilgsnius. Garsi lietuvė dažniausiai savo kasdienybės akimirkomis ir dalyvavimu įvairiuose renginiuose dalijasi socialiniuose tinkluose, ypač Instagram paskyroje. Ten sekėjai gali išvysti ne tik jos stiliaus pasirinkimus, bet ir jaukias šeimos akimirkas su mažamečiais vaikais. Vis dėlto šįkart, panašu, kad ji laiką leido kiek kitaip - be vaikų, daugiau dėmesio skirdama sau ir savo įvaizdžiui. Tai išduoda ir jos pasirinktas elegantiškas, moteriškumą pabrėžiantis derinys, subtiliai išryškinęs natūralų grožį. Juoda, aptempta suknelė ant jos figūros atrodė tarsi pasiūta specialiai jai - pabrėžė siluetą ir suteikė rafinuotumo. Verta paminėti, kad tai ne užsienio mados namų kūrinys. Šį įspūdingą drabužį Modesta įsigijo iš LuPa Mo.",https://www.delfi.lt/veidai/zmones/modesta-vzesniauskaite-pademonstravo-tikra-elegancija-sunku-atitraukti-akis-120242496
verslas,Nuotrauka su numestais kurjerių krepšiais pasiekė VMVT – pradėtas tyrimas,"Viešojoje erdvėje pasklidusi nuotrauka, kurioje matyti netvarkingai sumesti maisto pristatymo platformų Wolt ir Bolt Food kurjerių krepšiai, sudomino Valstybinę maisto ir veterinarijos tarnybą (VMVT). Ji įspėja, kad nustačius pažeidimų gresia poveikio priemonės. VMVT pirmadienį feisbuke paskelbė nuotrauką, kuri nepalieka abejingų. Kadre užfiksuoti netvarkingai išmėtyti Bolt Food ir Wolt kurjerių krepšiai. Dėkojame neabejingiems žmonėms už pateiktą informaciją ir įsitraukimą. VMVT vertina situaciją ir yra pradėjusi tyrimą aiškinasi galimas higienos problemas populiariose maisto pristatymo platformose, - rašė VMVT. Tarnyba Delfi patikslino, kad vaizdas fiksuotas Vilniuje, Daugėliškio gatvėje. Dėl viešojoje erdvėje pasirodžiusios informacijos jau kreiptasi į Bolt ir Wolt administracijas, nurodant detaliai pateikti informaciją, kaip užtikrinama higiena visame maisto pristatymo procese. Taigi, įvertinus aplinkybes ir tyrimo metu nustačius pažeidimų, bus taikytos teisės aktuose numatytos poveikio priemonės, - nurodė VMVT. Delfi dėl situacijos kreipėsi ir į Wolt. Gavę atsakymą tekstą papildysime. Šią nuotrauką padaręs vilnietis Algimantas (vardas pakeistas, tikras redakcijai žinomas) Delfi plačiau papasakojo, kad minėtoje vietoje maždaug metus nuomojamoje namo dalyje gyvena nežinomas kiekis kurjerių. Panašu kad ten jų daug. Aplinkiniams problemų nekelia, bet pro šalį einant vaizdas dažnai apetito nekelia. Nusprendžiau paviešinti, nes taip neturi būti, - sakė jis. Vyras pridūrė, kad prieš paviešindamas nuotrauką feisbuke užpildė pranešimą VMVT. Anksčiau, jo teigimu, lauke mėtydavosi po vieną du krepšius, tačiau praėjusį sekmadienį, kai darytas kadras, jų kieme buvo daugiau. Vakar buvo sekmadienis, blogas oras, matyt, daugiau ten gyvenančių nedirbo, ir krepšių daugiau buvo, - svarstė Algimantas. Pats jis teigė maisto pristatymo platformų paslaugomis nesinaudojantis. Maisto pristatymas yra gera paslauga, bet turėtų būti saugi ir kokybiška. Gal ateityje, jei kas pasikeis, ir pradėsiu naudotis. Su Delfi jis pasidalijo daugiau nuotraukų. Jas galite pamatyti žemiau: Bolt Food generalinis vadovas Lietuvoje Laurynas Pamparas Delfi komentavo, kad neturi galimybės pakomentuoti pateiktų nuotraukų, nes neturi informacijos, kuri galėtų padėti identifikuoti, ar Bolt Food ženklu pažymėti krepšiai buvo naudojami aktyviai su platforma bendradarbiaujančių nepriklausomų partnerių. Maisto pristatymo krepšys yra partnerio kurjerio nuosavybė, tad gali būti naudojamas ir asmens, nevykdančio ar nebevykdančio pristatymo veiklos per platformą Bolt Food, - teigė L. Pamparas. Toliau jis tęsė, kad nepriklausomi pristatymo partneriai kurjeriai, pradėdami vykdyti individualią veiklą per Bolt Food platformą, įsipareigoja laikytis platformos sąlygų, tarp jų ir reikalavimų užtikrinti, kad patiekalai ir prekės būtų pristatomos saugios būklės, laikantis sveikatos ir maisto saugos principų. Pristatymo partneris, anot L. Pamparo, prieš kiekvieną maisto pristatymą turi įsitikinti, kad naudojamas termo krepšys yra švarus, tvarkingas ir naudojamas taip, kad būtų išvengta maisto užteršimo bei užtikrinta maisto ir sveikatos sauga. Su Bolt Food bendradarbiaujantiems kurjeriams reguliariai primename higienos užtikrinimo svarbą ir būtinybę. Be to, Bolt Market parduotuvėse esame įrengę krepšių valymo stoteles ir raginame nepriklausomus partnerius jomis pasinaudoti, reguliariai išvalyti bei dezinfekuoti maisto pristatymui naudojamus krepšius, - tvirtino įmonės atstovas. Klientus jis ragino po kiekvieno pristatymo naudojantis platforma Bolt Food palikti atsiliepimą apie pristatymo kokybę bei kitas reikšmingas aplinkybes. Į klientų atsiliepimus esą žiūrima labai rimtai. Gavę klientų pranešimus apie galimus higienos reikalavimų pažeidimus pristatymo metu, kiekvieną situaciją vertiname individualiai, atsižvelgdami į galimo pažeidimo pobūdį ir mastą. Priklausomai nuo aplinkybių, imamės atitinkamų veiksmų - primename partneriams apie jų įsipareigojimą užtikrinti, kad prekės būtų pristatomos saugios būklės, laikantis sveikatos ir maisto saugos reikalavimų. Taip pat dalinamės saugaus pristatymo gairėmis bei gerąja praktika, siekdami užtikrinti per platformą teikiamų paslaugų kokybę ir saugumą. Nustačius rimtus ar pasikartojančius pažeidimus, tam tikrais atvejais galime taikyti griežtesnes priemones - įskaitant nepriklausomo partnerio laikiną ar nuolatinį prieigos prie platformos sustabdymą, - teigė jis ir pridūrė, kad platforma visada bendradarbiauja su atsakingomis institucijomis, įskaitant ir šį atvejį. Wolt komunikacijos specialistė Baltijos šalims Akvilė Grašytė komentavo, kad apie šį atvejį yra informuoti ir renka papildomą informaciją. Šiuo metu renkame papildomą informaciją ir tiksliname aplinkybes, įskaitant nuotraukose matomų pristatymo priemonių laikymo sąlygas, bei siekiame nustatyti su situacija susijusius asmenis. Įvertinus faktines aplinkybes ir nustačius higienos normų ar standartų pažeidimus, Wolt gali nutraukti bendradarbiavimą su atitinkamais kurjeriais-partneriais. Taip pat išsiuntėme papildomą priminimą visai kurjerių-partnerių bendruomenei Lietuvoje, dar kartą primindami apie galiojančius higienos reikalavimus ir atsakomybę vykdant veiklą susijusią su maisto pristatymais. Norime pabrėžti, kad Wolt labai atsakingai žiūri į higienos, švaros ir maisto saugos klausimus. Visi su Wolt bendradarbiaujantys kurjeriai-partneriai, pasirašydami bendradarbiavimo sutartį, įsipareigoja laikytis paslaugų teikimo sąlygų, kuriose numatyti ir užsakymų pristatymo kokybės ir maisto saugos standartai, - komentuoja Wolt atstovė. Taip pat komentare Delfi prabrėžiama, kad kurjeriai-partneriai su Wolt bendradarbiauja individualios veiklos pagrindu ir patys atsako už naudojamų priemonių, įskaitant ir pristatymo krepšių, tinkamą priežiūrą. Savo ruožtu Wolt užtikrina, kad kurjeriai-partneriai su higienos ir maisto transportavimo reikalavimais, įskaitant valstybės institucijų nustatytas privalomas higienos taisykles, būtų supažindinami bendradarbiavimo pradžioje, o vėliau, ne rečiau nei kartą per ketvirtį, jiems apie tai reguliariai primename. Reaguodami į šią situaciją, priminimus dar labiau suaktyvinome. Kurjeriai-partneriai reguliariai informuojami, kad pristatymo krepšiai turi būti švarūs ir periodiškai valomi, o tuo metu, kai nėra naudojami užsakymų pristatymams - laikomi vidaus patalpose. Griežti higienos reikalavimai ir jų laikymasis yra vienas iš mūsų veiklos prioritetų. Kiekvieną gautą pranešimą apie galimus pažeidimus vertiname rimtai ir, esant pagrįstam pagrindui, imamės atitinkamų veiksmų. Nustačius, kad užsakymų pristatymui naudojamos priemonės yra netinkamos arba neprižiūrimos, kurjerio-partnerio prieiga prie platformos gali būti apribojama, - sako A. Grašytė. VMVT taip pat priminė, kad maisto sauga turi būti užtikrinama visoje tiekimo grandinėje: nuo maisto paruošimo iki pristatymo klientui. Kurjeriai privalo laikytis higienos reikalavimų transportuojant maistą, o už saugų maisto paruošimą ir supakavimą atsakingos maitinimo įstaigos. Maisto išvežiojimo (kurjerių) veikla gali būti vykdoma tik turint VMVT išduotą leidimą tokiai veiklai. Įmonės, kurios teikia maisto išvežiojimo paslaugas, privalo sisteminti informaciją apie asmenis (kurjerius), kurie išvežioja maisto produktus ar paruoštus patiekalus, kad prireikus būtų užtikrintas tiekiamo maisto atsekamumas. Maistą užsisakantys žmonės gali pasitikrinti, ar maisto pristatymo paslaugas teikianti įmonė veikia oficialiai ir yra registruota VMVT: https://vmvt.lt/opendata/mtsr/ . Maistą pristatantis asmuo (kurjeris), prieš pradėdamas darbą, privalo būti pasitikrinęs sveikatą, turėti galiojantį sveikatos žinių atestavimo pažymėjimą ir laikytis higienos reikalavimų. Transportavimo metu būtina užtikrinti tinkamas sąlygas: transporto priemonės paviršiai turi būti švarūs, lengvai valomi ir dezinfekuojami, o pačioje transporto priemonėje turi būti visos reikalingos higienos priemonės - vienkartinės servetėlės, šluostės ar kitos dezinfekavimo priemonės. Be to, maisto vežimo krepšiai ar šaltkrepšiai turi būti švarūs ir tvarkingi, o pats maistas, įskaitant greitai gendančius maisto produktus - gabenamas laikantis gamintojo nurodytų laikymo sąlygų. Tiesa, vartotojai yra pirmieji, kurie gali signalizuoti apie pastebimus pažeidimus - išsiliejusį, sugadintą ar akivaizdžiai netinkamos kokybės maistą, nešvarius krepšius. Tokiais atvejais svarbu tai užfiksuoti nuotraukomis ar vaizdo įrašu. Pirmiausia rekomenduojame informuoti kurjerių paslaugas teikiančias įmones, kad jos galėtų operatyviai sureaguoti ir identifikuoti netvarkingą darbuotoją. Jei situacijos nepavyksta išspręsti geranoriškai arba ji kartojasi, pranešti reikėtų VMVT, pateikiant nuotraukas, užsakymo informaciją bei išsamų situacijos aprašymą - tai padės inicijuoti pažeidimo tyrimą, - nurodo VMVT. Jei maistas atrodo nekokybiškas, išsiliejęs ar kitaip sugadintas, vartotojai neturėtų rizikuoti savo sveikata ir jo nevartoti. 2025 metais VMVT sulaukė 54 vartotojų pranešimų dėl maisto pristatymo į namus, daugiausia - Vilniuje ir Kaune. Šiemet tokių pranešimų jau gauta 25.",https://www.delfi.lt/verslas/naujienos/nuotrauka-su-numestais-kurjeriu-krepsiais-pasieke-vmvt-pradetas-tyrimas-120242441
verslas,"Atsiskaičius su VMI, reikia atsiskaityti ir su „Sodra“: kaip ir kada susimokėti","Savarankiškai dirbantys gyventojai, deklaravę pajamas, nuo uždirbtų pajamų turi sumokėti ir įmokas Sodrai. Informacija apie mokėtinas sumas ir galimybę kreiptis dėl įmokų mokėjimo dalimis pateikiama asmeninėse Sodros paskyrose. Šiemet deklaravimo ir įmokų mokėjimo laikotarpis baigiasi gegužės 4 d. Deklaruoti pajamas ir sumokėti įmokas Sodrai turi žmonės, kurie 2025 metais dirbo savarankiškai, pavyzdžiui, vykdė individualią veiklą su pažyma, buvo mažųjų bendrijų ar ūkinių bendrijų nariai, individualių įmonių savininkai bei ūkininkai, kurių ūkio ekonominis dydis viršija 4 EDV. Sodra asmeniškai informuoja savarankiškai dirbančius asmenis, kiek ir kokių įmokų jie turi sumokėti po deklaravimo. Deklaravus pajamas, žinutės su informacija apie mokėtinas įmokas siunčiamos į savarankiškai dirbančių žmonių asmenines Sodros paskyras. Žinutėje pateikiama: Mokėtina suma - nuo deklaruotų apmokestinamųjų pajamų mokėtina VSD ir PSD įmokų suma; Likutis - įvertinus anksčiau sumokėtas sumas likusi sumokėti VSD ir PSD įmokų suma; Mokėjimo terminas - 2026 m. gegužės 4 d.; Mokėjimo rekvizitai ir svarbūs duomenys, pavyzdžiui, įmokos kodas; Informacija apie galimybę atidėti įmokų mokėjimą, jei susidaro įsiskolinimas. Pajamas deklaravę gyventojai savo įmokų Sodrai dydį taip pat gali sužinoti prisijungę prie asmeninės paskyros ir patikrinę skiltį Įmokos . Paskyrose savarankiškai dirbantys žmonės ras ir daugiau svarbios informacijos apie įmokų mokėjimą bei kitas Sodros paslaugas. Įmokas Sodrai galima sumokėti keliais patogiais būdais. Gyventojai tai gali padaryti asmeninių paskyrų Įmokų skiltyje pasirinkę funkciją Mokėti, taip pat atlikdami banko pavedimą į vieną iš Sodros surenkamųjų sąskaitų. Įmokas galima sumokėti ir grynaisiais pinigais Lietuvos pašto skyriuose ir Perlo terminaluose kai kuriose parduotuvėse. Jeigu sumokėti įmokas kyla sunkumų, gyventojai gali kreiptis į Sodrą dėl įmokų atidėjimo. Atidėti įmokų mokėjimą supaprastinta tvarka galima, jei socialinio draudimo įmokų įsiskolinimas ne mažesnis nei 125 eurų ir neviršija 1500 eurų. Jei įsiskolinimas viršija 1500 eurų, prašyme dėl skolos atidėjimo reikia nurodyti įmokų mokėjimo grafiką, priežastis, kodėl negalite sumokėti įsiskolinimo. Įmokų įsiskolinimo sumokėjimas gali būti atidedamas vieną kartą per metus. Prašymą dėl įmokų mokėjimo įsiskolinimo atidėjimo galima pateikti nuo gegužės 4 d. Daugiau informacijos apie įmokų atidėjimą rasite čia: Ar galiu skolą Sodrai sumokėti dalimis? Jei savarankiškai dirbantys gyventojai įmokas moka kartą per metus, jie gali pasirinkti, kaip jų per metus gautos pajamos bus paskirstomos skaičiuojant socialinio draudimo įmokas. Įprastai deklaruotos metinės pajamos paskirstomos tolygiai per veiklos vykdymo mėnesius, nepriklausomai nuo to, kada faktiškai jos buvo gautos. Vis dėlto gyventojai turi galimybę pasirinkti ir kitą būdą - kad pajamos būtų vertinamos pagal realiai kiekvieną kalendorinį mėnesį gautas ar asmeniniams poreikiams išsiimtas sumas. Tokiu atveju metinėje pajamų deklaracijoje Valstybinei mokesčių inspekcijai pasirenkamas įmokų tipas Sodros mėnesinis. Šis pasirinkimas leidžia tiksliau atspindėti faktinį pajamų pasiskirstymą per metus. Jei žmogus renkasi mokėti VSD įmokas kiekvieną mėnesį, prireikus jis gali greičiau gauti socialinio draudimo išmokas. Dirbdamas savarankiškai žmogus gali nuspręsti, kokio dydžio VSD įmokas jis mokės kiekvieną mėnesį: pavyzdžiui, nuo faktiškai tą mėnesį uždirbtų ar nuo planuojamų uždirbti pajamų, nuo minimalios mėnesio algos ar nuo kitos sumos. Labai svarbu įvertinti, ar kiekvieną mėnesį deklaruotos sumos susumavus už metus neviršija įmokų bazės, nustatytos įstatyme: 90 proc. nuo apmokestinamųjų pajamų vykdant individualią veiklą ir individualią žemės ūkio veiklą ar 50 proc. nuo asmeniniams poreikiams išsiimtos lėšų sumos mažųjų bendrijų, ūkinių bendrijų nariams ar individualių įmonių savininkams. Deklaruojant pajamas svarbu atkreipti dėmesį į tai, kad metinė suma, nuo kurios sumokėtos Sodros įmokos ir VMI deklaruota apmokestinamųjų pajamų sutaptų. Tai reiškia, kad negalima sumokėti daugiau įmokų, nei siekia gyventojo deklaruotos pajamos, kadangi socialinio draudimo įmokų bazė visuomet yra susijusi su apmokestinamomis pajamomis. Taigi, galima sumokėti įmokas į priekį, tačiau deklaruojant pajamas, VMI deklaruojama apmokestinamoji suma ir suma, nuo kurios mokėtos socialinio draudimo įmokos , turi sutapti.",https://www.delfi.lt/verslas/mano-eurai/atsiskaicius-su-vmi-reikia-atsiskaityti-ir-su-sodra-kaip-ir-kada-susimoketi-120242520
